<?xml version="1.0" encoding="UTF-8"?>
<!--
Copyright © 2019 eMedia Intellect.

This file is part of eMI Spanish Verb Conjugator.

eMI Spanish Verb Conjugator is free software: you can redistribute it and/or modify
it under the terms of the GNU General Public License as published by
the Free Software Foundation, either version 3 of the License, or
(at your option) any later version.

eMI Spanish Verb Conjugator is distributed in the hope that it will be useful,
but WITHOUT ANY WARRANTY; without even the implied warranty of
MERCHANTABILITY or FITNESS FOR A PARTICULAR PURPOSE. See the
GNU General Public License for more details.

You should have received a copy of the GNU General Public License
along with eMI Spanish Verb Conjugator. If not, see http://www.gnu.org/licenses/.
-->
<verb xmlns="http://emi.is/eMI-Spanish-Verb-Conjugator/Conjugations" xmlns:xsi="http://www.w3.org/2001/XMLSchema-instance" xsi:schemaLocation="http://emi.is/eMI-Spanish-Verb-Conjugator/Conjugations ../../Conjugations.xsd">
	<form type="infinitive">sustituir</form>
	<form type="gerund">sustituyendo</form>
	<form type="past-participle">sustituido, sustituto</form>
	<mood type="indicative">
		<tense type="present">
			<conjugation number="singular" person="1">sustituyo</conjugation>
			<conjugation number="singular" person="2">sustituyes</conjugation>
			<conjugation number="singular" person="3">sustituye</conjugation>
			<conjugation number="plural" person="3">sustituyen</conjugation>
		</tense>
		<tense type="preterite">
			<conjugation number="singular" person="3">sustituyó</conjugation>
			<conjugation number="plural" person="3">sustituyeron</conjugation>
		</tense>
	</mood>
	<mood type="subjunctive">
		<tense type="present">
			<conjugation number="singular" person="1">sustituya</conjugation>
			<conjugation number="singular" person="2">sustituyas</conjugation>
			<conjugation number="singular" person="3">sustituya</conjugation>
			<conjugation number="plural" person="1">sustituyamos</conjugation>
			<conjugation number="plural" person="2">sustituyáis</conjugation>
			<conjugation number="plural" person="3">sustituyan</conjugation>
		</tense>
		<tense type="imperfect" variant="ra">
			<conjugation number="singular" person="1">sustituyera</conjugation>
			<conjugation number="singular" person="2">sustituyeras</conjugation>
			<conjugation number="singular" person="3">sustituyera</conjugation>
			<conjugation number="plural" person="1">sustituyéramos</conjugation>
			<conjugation number="plural" person="2">sustituyerais</conjugation>
			<conjugation number="plural" person="3">sustituyeran</conjugation>
		</tense>
		<tense type="imperfect" variant="se">
			<conjugation number="singular" person="1">sustituyese</conjugation>
			<conjugation number="singular" person="2">sustituyeses</conjugation>
			<conjugation number="singular" person="3">sustituyese</conjugation>
			<conjugation number="plural" person="1">sustituyésemos</conjugation>
			<conjugation number="plural" person="2">sustituyeseis</conjugation>
			<conjugation number="plural" person="3">sustituyesen</conjugation>
		</tense>
		<tense type="future">
			<conjugation number="singular" person="1">sustituyere</conjugation>
			<conjugation number="singular" person="2">sustituyeres</conjugation>
			<conjugation number="singular" person="3">sustituyere</conjugation>
			<conjugation number="plural" person="1">sustituyéremos</conjugation>
			<conjugation number="plural" person="2">sustituyereis</conjugation>
			<conjugation number="plural" person="3">sustituyeren</conjugation>
		</tense>
	</mood>
	<mood type="imperative">
		<tense variant="affirmative">
			<conjugation number="singular" person="2">sustituye</conjugation>
			<conjugation number="singular" person="3">sustituya</conjugation>
			<conjugation number="plural" person="1">sustituyamos</conjugation>
			<conjugation number="plural" person="3">sustituyan</conjugation>
		</tense>
		<tense variant="negative">
			<conjugation number="singular" person="2">sustituyas</conjugation>
			<conjugation number="singular" person="3">sustituya</conjugation>
			<conjugation number="plural" person="1">sustituyamos</conjugation>
			<conjugation number="plural" person="2">sustituyáis</conjugation>
			<conjugation number="plural" person="3">sustituyan</conjugation>
		</tense>
	</mood>
</verb>