<?xml version="1.0" encoding="UTF-8"?>
<!--
Copyright © 2019 eMedia Intellect.

This file is part of eMI Spanish Verb Conjugator.

eMI Spanish Verb Conjugator is free software: you can redistribute it and/or modify
it under the terms of the GNU General Public License as published by
the Free Software Foundation, either version 3 of the License, or
(at your option) any later version.

eMI Spanish Verb Conjugator is distributed in the hope that it will be useful,
but WITHOUT ANY WARRANTY; without even the implied warranty of
MERCHANTABILITY or FITNESS FOR A PARTICULAR PURPOSE. See the
GNU General Public License for more details.

You should have received a copy of the GNU General Public License
along with eMI Spanish Verb Conjugator. If not, see http://www.gnu.org/licenses/.
-->
<verb xmlns="http://emi.is/eMI-Spanish-Verb-Conjugator/Conjugations" xmlns:xsi="http://www.w3.org/2001/XMLSchema-instance" xsi:schemaLocation="http://emi.is/eMI-Spanish-Verb-Conjugator/Conjugations ../../Conjugations.xsd">
	<form type="infinitive">andar</form>
	<mood type="indicative">
		<tense type="preterite">
			<conjugation number="singular" person="1">anduve</conjugation>
			<conjugation number="singular" person="2">anduviste</conjugation>
			<conjugation number="singular" person="3">anduvo</conjugation>
			<conjugation number="plural" person="1">anduvimos</conjugation>
			<conjugation number="plural" person="2">anduvisteis</conjugation>
			<conjugation number="plural" person="3">anduvieron</conjugation>
		</tense>
	</mood>
	<mood type="subjunctive">
		<tense type="imperfect" variant="ra">
			<conjugation number="singular" person="1">anduviera</conjugation>
			<conjugation number="singular" person="2">anduvieras</conjugation>
			<conjugation number="singular" person="3">anduviera</conjugation>
			<conjugation number="plural" person="1">anduviéramos</conjugation>
			<conjugation number="plural" person="2">anduvierais</conjugation>
			<conjugation number="plural" person="3">anduvieran</conjugation>
		</tense>
		<tense type="imperfect" variant="se">
			<conjugation number="singular" person="1">anduviese</conjugation>
			<conjugation number="singular" person="2">anduvieses</conjugation>
			<conjugation number="singular" person="3">anduviese</conjugation>
			<conjugation number="plural" person="1">anduviésemos</conjugation>
			<conjugation number="plural" person="2">anduvieseis</conjugation>
			<conjugation number="plural" person="3">anduviesen</conjugation>
		</tense>
		<tense type="future">
			<conjugation number="singular" person="1">anduviere</conjugation>
			<conjugation number="singular" person="2">anduvieres</conjugation>
			<conjugation number="singular" person="3">anduviere</conjugation>
			<conjugation number="plural" person="1">anduviéremos</conjugation>
			<conjugation number="plural" person="2">anduviereis</conjugation>
			<conjugation number="plural" person="3">anduvieren</conjugation>
		</tense>
	</mood>
</verb>