<?xml version="1.0" encoding="UTF-8"?>
<!--
Copyright © 2019 eMedia Intellect.

This file is part of eMI Spanish Verb Conjugator.

eMI Spanish Verb Conjugator is free software: you can redistribute it and/or modify
it under the terms of the GNU General Public License as published by
the Free Software Foundation, either version 3 of the License, or
(at your option) any later version.

eMI Spanish Verb Conjugator is distributed in the hope that it will be useful,
but WITHOUT ANY WARRANTY; without even the implied warranty of
MERCHANTABILITY or FITNESS FOR A PARTICULAR PURPOSE. See the
GNU General Public License for more details.

You should have received a copy of the GNU General Public License
along with eMI Spanish Verb Conjugator. If not, see http://www.gnu.org/licenses/.
-->
<verb xmlns="http://emi.is/eMI-Spanish-Verb-Conjugator/Conjugations" xmlns:xsi="http://www.w3.org/2001/XMLSchema-instance" xsi:schemaLocation="http://emi.is/eMI-Spanish-Verb-Conjugator/Conjugations ../../Conjugations.xsd">
	<form type="infinitive">construir</form>
	<form type="gerund">construyendo</form>
	<mood type="indicative">
		<tense type="present">
			<conjugation number="singular" person="1">construyo</conjugation>
			<conjugation number="singular" person="2">construyes</conjugation>
			<conjugation number="singular" person="3">construye</conjugation>
			<conjugation number="plural" person="3">construyen</conjugation>
		</tense>
		<tense type="preterite">
			<conjugation number="singular" person="3">construyó</conjugation>
			<conjugation number="plural" person="3">construyeron</conjugation>
		</tense>
	</mood>
	<mood type="subjunctive">
		<tense type="present">
			<conjugation number="singular" person="1">construya</conjugation>
			<conjugation number="singular" person="2">construyas</conjugation>
			<conjugation number="singular" person="3">construya</conjugation>
			<conjugation number="plural" person="1">construyamos</conjugation>
			<conjugation number="plural" person="2">construyáis</conjugation>
			<conjugation number="plural" person="3">construyan</conjugation>
		</tense>
		<tense type="imperfect" variant="ra">
			<conjugation number="singular" person="1">construyera</conjugation>
			<conjugation number="singular" person="2">construyeras</conjugation>
			<conjugation number="singular" person="3">construyera</conjugation>
			<conjugation number="plural" person="1">construyéramos</conjugation>
			<conjugation number="plural" person="2">construyerais</conjugation>
			<conjugation number="plural" person="3">construyeran</conjugation>
		</tense>
		<tense type="imperfect" variant="se">
			<conjugation number="singular" person="1">construyese</conjugation>
			<conjugation number="singular" person="2">construyeses</conjugation>
			<conjugation number="singular" person="3">construyese</conjugation>
			<conjugation number="plural" person="1">construyésemos</conjugation>
			<conjugation number="plural" person="2">construyeseis</conjugation>
			<conjugation number="plural" person="3">construyesen</conjugation>
		</tense>
		<tense type="future">
			<conjugation number="singular" person="1">construyere</conjugation>
			<conjugation number="singular" person="2">construyeres</conjugation>
			<conjugation number="singular" person="3">construyere</conjugation>
			<conjugation number="plural" person="1">construyéremos</conjugation>
			<conjugation number="plural" person="2">construyereis</conjugation>
			<conjugation number="plural" person="3">construyeren</conjugation>
		</tense>
	</mood>
	<mood type="imperative">
		<tense variant="affirmative">
			<conjugation number="singular" person="2">construye</conjugation>
			<conjugation number="singular" person="3">construya</conjugation>
			<conjugation number="plural" person="1">construyamos</conjugation>
			<conjugation number="plural" person="3">construyan</conjugation>
		</tense>
		<tense variant="negative">
			<conjugation number="singular" person="2">construyas</conjugation>
			<conjugation number="singular" person="3">construya</conjugation>
			<conjugation number="plural" person="1">construyamos</conjugation>
			<conjugation number="plural" person="2">construyáis</conjugation>
			<conjugation number="plural" person="3">construyan</conjugation>
		</tense>
	</mood>
</verb>