<?xml version="1.0" encoding="UTF-8"?>
<!--
Copyright © 2019 eMedia Intellect.

This file is part of eMI Spanish Verb Conjugator.

eMI Spanish Verb Conjugator is free software: you can redistribute it and/or modify
it under the terms of the GNU General Public License as published by
the Free Software Foundation, either version 3 of the License, or
(at your option) any later version.

eMI Spanish Verb Conjugator is distributed in the hope that it will be useful,
but WITHOUT ANY WARRANTY; without even the implied warranty of
MERCHANTABILITY or FITNESS FOR A PARTICULAR PURPOSE. See the
GNU General Public License for more details.

You should have received a copy of the GNU General Public License
along with eMI Spanish Verb Conjugator. If not, see http://www.gnu.org/licenses/.
-->
<verb xmlns="http://emi.is/eMI-Spanish-Verb-Conjugator/Conjugations" xmlns:xsi="http://www.w3.org/2001/XMLSchema-instance" xsi:schemaLocation="http://emi.is/eMI-Spanish-Verb-Conjugator/Conjugations ../../Conjugations.xsd">
	<form type="infinitive">consentir</form>
	<form type="gerund">consintiendo</form>
	<mood type="indicative">
		<tense type="present">
			<conjugation number="singular" person="1">consiento</conjugation>
			<conjugation number="singular" person="2">consientes</conjugation>
			<conjugation number="singular" person="3">consiente</conjugation>
			<conjugation number="plural" person="3">consienten</conjugation>
		</tense>
		<tense type="preterite">
			<conjugation number="singular" person="3">consintió</conjugation>
			<conjugation number="plural" person="3">consintieron</conjugation>
		</tense>
	</mood>
	<mood type="subjunctive">
		<tense type="present">
			<conjugation number="singular" person="1">consienta</conjugation>
			<conjugation number="singular" person="2">consientas</conjugation>
			<conjugation number="singular" person="3">consienta</conjugation>
			<conjugation number="plural" person="1">consintamos</conjugation>
			<conjugation number="plural" person="2">consintáis</conjugation>
			<conjugation number="plural" person="3">consientan</conjugation>
		</tense>
		<tense type="imperfect" variant="ra">
			<conjugation number="singular" person="1">consintiera</conjugation>
			<conjugation number="singular" person="2">consintieras</conjugation>
			<conjugation number="singular" person="3">consintiera</conjugation>
			<conjugation number="plural" person="1">consintiéramos</conjugation>
			<conjugation number="plural" person="2">consintierais</conjugation>
			<conjugation number="plural" person="3">consintieran</conjugation>
		</tense>
		<tense type="imperfect" variant="se">
			<conjugation number="singular" person="1">consintiese</conjugation>
			<conjugation number="singular" person="2">consintieses</conjugation>
			<conjugation number="singular" person="3">consintiese</conjugation>
			<conjugation number="plural" person="1">consintiésemos</conjugation>
			<conjugation number="plural" person="2">consintieseis</conjugation>
			<conjugation number="plural" person="3">consintiesen</conjugation>
		</tense>
		<tense type="future">
			<conjugation number="singular" person="1">consintiere</conjugation>
			<conjugation number="singular" person="2">consintieres</conjugation>
			<conjugation number="singular" person="3">consintiere</conjugation>
			<conjugation number="plural" person="1">consintiéremos</conjugation>
			<conjugation number="plural" person="2">consintiereis</conjugation>
			<conjugation number="plural" person="3">consintieren</conjugation>
		</tense>
	</mood>
	<mood type="imperative">
		<tense variant="affirmative">
			<conjugation number="singular" person="2">consiente</conjugation>
			<conjugation number="singular" person="3">consienta</conjugation>
			<conjugation number="plural" person="1">consintamos</conjugation>
			<conjugation number="plural" person="3">consientan</conjugation>
		</tense>
		<tense variant="negative">
			<conjugation number="singular" person="2">consientas</conjugation>
			<conjugation number="singular" person="3">consienta</conjugation>
			<conjugation number="plural" person="1">consintamos</conjugation>
			<conjugation number="plural" person="2">consintáis</conjugation>
			<conjugation number="plural" person="3">consientan</conjugation>
		</tense>
	</mood>
</verb>