<?xml version="1.0" encoding="UTF-8"?>
<!--
Copyright © 2019 eMedia Intellect.

This file is part of eMI Spanish Verb Conjugator.

eMI Spanish Verb Conjugator is free software: you can redistribute it and/or modify
it under the terms of the GNU General Public License as published by
the Free Software Foundation, either version 3 of the License, or
(at your option) any later version.

eMI Spanish Verb Conjugator is distributed in the hope that it will be useful,
but WITHOUT ANY WARRANTY; without even the implied warranty of
MERCHANTABILITY or FITNESS FOR A PARTICULAR PURPOSE. See the
GNU General Public License for more details.

You should have received a copy of the GNU General Public License
along with eMI Spanish Verb Conjugator. If not, see http://www.gnu.org/licenses/.
-->
<verb xmlns="http://emi.is/eMI-Spanish-Verb-Conjugator/Conjugations" xmlns:xsi="http://www.w3.org/2001/XMLSchema-instance" xsi:schemaLocation="http://emi.is/eMI-Spanish-Verb-Conjugator/Conjugations ../../Conjugations.xsd">
	<form type="infinitive">creer</form>
	<mood type="indicative">
		<tense type="preterite">
			<conjugation number="singular" person="2">creíste</conjugation>
			<conjugation number="singular" person="3">creyó</conjugation>
			<conjugation number="plural" person="1">creímos</conjugation>
			<conjugation number="plural" person="2">creísteis</conjugation>
			<conjugation number="plural" person="3">creyeron</conjugation>
		</tense>
	</mood>
	<mood type="subjunctive">
		<tense type="imperfect" variant="ra">
			<conjugation number="singular" person="1">creyera</conjugation>
			<conjugation number="singular" person="2">creyeras</conjugation>
			<conjugation number="singular" person="3">creyera</conjugation>
			<conjugation number="plural" person="1">creyéramos</conjugation>
			<conjugation number="plural" person="2">creyerais</conjugation>
			<conjugation number="plural" person="3">creyeran</conjugation>
		</tense>
		<tense type="imperfect" variant="se">
			<conjugation number="singular" person="1">creyese</conjugation>
			<conjugation number="singular" person="2">creyeses</conjugation>
			<conjugation number="singular" person="3">creyese</conjugation>
			<conjugation number="plural" person="1">creyésemos</conjugation>
			<conjugation number="plural" person="2">creyeseis</conjugation>
			<conjugation number="plural" person="3">creyesen</conjugation>
		</tense>
		<tense type="future">
			<conjugation number="singular" person="1">creyere</conjugation>
			<conjugation number="singular" person="2">creyeres</conjugation>
			<conjugation number="singular" person="3">creyere</conjugation>
			<conjugation number="plural" person="1">creyéremos</conjugation>
			<conjugation number="plural" person="2">creyereis</conjugation>
			<conjugation number="plural" person="3">creyeren</conjugation>
		</tense>
	</mood>
</verb>